{
  "version": 1,
  "tracker": { "kind": "file", "prefix": "PRJ" },
  "base": "main",
  "delivery": "merge_push",
  "returns": 5,
  "references": { "terminology": "docs/terms.md" },
  "checks": [
    "npm test",
    { "run": "vendor/bin/noverify check ./src", "baseline": "files_outside_diff", "diagnostic": "^(?<file>\\S+\\.php):\\d+" }
  ],
  "worktree": { "root": ".worktrees", "link": ["docker-compose.dev.yml"], "copy": [".env"], "setup": ["npm ci"] },
  "stage": {
    "ports": ["app"],
    "start": "npm run dev -- --port {port.app}",
    "health": "/up",
    "env": { "APP_URL": "{url}" }
  }
}
